Job Title,Company,Location,Job Description,Job link
Research Intern,Haize Labs,"New York, NY, ▪ ...","We are looking for Software Engineers to help us to develop fundamental safety tooling for LLMs.
Work directly with customers to adapt core R&D for different domains.
Build out core infrastructure, cloud tooling, and UX around algorithms.
Deliver a delightful human-in-the-loop product experience.
Ship tools that are used by developers across the world.",https://job-boards.greenhouse.io/haizelabs/jobs/4070377008
"Director / Senior Director, Accelerator",Evidence Action,"Washington, DC, ▪ ...","In this role, you'll lead Evidence Action's Accelerator process and Cost-Effectiveness team to identify, test, and scale high-impact global health interventions.
Optimize the Accelerator process, evaluating and prioritizing potential programs against evidence, cost-effectiveness, and scalability criteria.
Lead fundraising efforts for Accelerator programs through proposal development, donor cultivation, and external engagement.
Guide the design of effective pilots with robust monitoring and evaluation approaches to test key assumptions.",https://apply.workable.com/evidence-action/j/D116816FF8/
Research Fellow,"University of California, Center for Human-Compatible Artificial Intelligence","San Francisco Bay Area, ▪ ...","The CHAI Research Fellowship offers flexible start dates.
The fellowship is aimed at postdoctoral researchers to advance beneficial AI.
Fellows will have freedom to pursue novel research in various theoretical and practical AI domains.
Responsibilities include leading collaborations and potentially teaching.
Outcomes include published research and contributions to the field of AI.",https://humancompatible.ai/jobs#the-chai-research-fellowship
"Technical Manager, Vaccine Cold Chain and Logistics",Clinton Health Access Initiative,"USA, ▪ ...","In this role, you'll lead technical areas of CHAI's vaccine delivery program with a focus on cold chain and logistics.
Develop strategic initiatives and drive fundraising to improve immunization outcomes in focus countries.
Provide technical leadership for country teams implementing high-impact immunization programs.
Establish yourself as a thought leader to improve national and global practices in vaccine delivery.
Manage a global team of 2-3 technical advisors while serving on the management team for CHAI's vaccine program.",https://careers-chai.icims.com/jobs/14563/technical-manager%2c-vaccine-cold-chain-and-logistics/job?in_iframe=1
Science and Technology Policy Fellow,American Association for the Advancement of Science,"Washington, DC, ▪ ...","In this role, you'll contribute your scientific expertise to federal policymaking while gaining hands-on policy experience in Washington DC.
Serve in a yearlong assignment within executive, legislative or judicial branches of government.
Participate in a comprehensive professional development program including workshops on policy, leadership and communication.
Engage with a powerful network of approximately 4,000 fellows and alumni across government, industry, academia and nonprofits.",https://www.aaas.org/programs/science-technology-policy-fellowships/become-st-policy-fellow
"Research Intern, Office of Distinguished Fellow, Walter Russell Mead",Hudson Institute,"Washington, DC, ▪ ...","In this role, you'll provide research and administrative support to Distinguished Fellow Walter Russell Mead at Hudson Institute, focusing on Indo-Pacific issues, Ukraine, Israel, and other foreign policy topics.
Perform background research for weekly columns and podcasts while analyzing data for reports.
Monitor current events and assist with research projects, presentations, articles, and briefing memos.
Engage directly with policy experts and attend Hudson Institute events in Washington, DC.
Support administrative tasks and event coordination in this in-person position.",https://recruiting.paylocity.com/Recruiting/Jobs/Details/2256551
"Enterprise Security Engineer, Remote US",OpenAI,"Remote, USA, ▪ ...","In this role, you'll implement and manage security for OpenAI's internal information systems and infrastructure.
Develop security measures to protect company information assets against unauthorized access or misuse.
Monitor systems for security threats and respond to alerts promptly.
Implement hardening best practices for AzureAD, GSuite, GitHub, and other SaaS tools.
Deploy zero-trust security models and educate employees on maintaining a secure environment.",https://openai.com/careers/enterprise-security-engineer-remote-us/
"Enterprise Security Engineer, San Francisco",OpenAI,"San Francisco Bay Area, ▪ ...","In this role, you'll implement and manage security for OpenAI's internal information systems and infrastructure.
Develop security measures to protect company information assets against unauthorized access or misuse.
Monitor systems for security threats and respond to alerts promptly.
Implement hardening measures for AzureAD, GSuite, GitHub, and other SaaS tools.
Design and deploy data protection controls including DLP and zero-trust security models.",https://openai.com/careers/enterprise-security-engineer-san-francisco/
"Research Intern, Great Power Competition",Hudson Institute,"Washington, DC, ▪ ...","In this role, you'll conduct research focused on great power competition and China, supporting Senior Fellow Michael Sobolik.
Gather and analyze data for podcasts, op-eds, and Senate hearings.
Keep the expert informed on current events related to US-China relations.
Assist with research projects, presentations, articles, and briefing memos.
Support administrative tasks and events while gaining exposure to critical international policy issues.",https://recruiting.paylocity.com/Recruiting/Jobs/Details/2984301
Head of Operations,HUD,"San Francisco Bay Area, ▪ ...","In this role, you'll set up, manage, and automate HUD's hiring/HR, expansion, and general operations as the company scales rapidly. 
Build operational foundations that let the team focus on AI safety evaluation research while ensuring smooth company growth.
Design and implement comprehensive hiring processes from job posting to onboarding.
Set up and manage HR systems, policies, and employee lifecycle management.
Automate workflows and technical processes for maximum efficiency.
Coordinate company expansion planning and execution while handling general startup operations.",https://jobs.ashbyhq.com/hud/f4d8ca21-c304-4d43-a917-3278fe0e99b2
Data Engineer,Elicit,"Remote, USA, ▪ San Francisco Bay Area, ▪ ...","In this role, you'll own building and optimizing an academic research paper pipeline.
Architect and implement robust, scalable solutions to handle growing data needs while maintaining high performance and data quality.
Work on efficiently processing, deduplicating, and indexing hundreds of millions of research papers.
Optimize Spark jobs and data pipelines to handle large amounts of data efficiently.
Develop processes to ensure regular updates from multiple academic paper sources are handled with efficient deduplication.",https://elicit.com/careers?ashby_jid=4617f630-f971-4716-b753-2915ce9c04a7
"Intern, Trustee Chair in Chinese Business and Economics (Fall 2025)",Center for Strategic and International Studies,"Washington, DC, ▪ ...","In this role, you'll support research on Chinese business, economics, and industrial policy for the CSIS Trustee Chair program.
Collect and analyze data on industrial policies, including firm-level data and government budgets in China and other economies.
Conduct research on industrial policy literature and news, assisting with qualitative and quantitative analysis for publications.
Write event summaries and provide logistical support for projects and events.
Manage multiple research priorities under tight deadlines while working both independently and as part of a team.",https://careers.csis.org/opportunities/1657
"Research Scientist / Engineer, Honesty",Anthropic,"San Francisco Bay Area, ▪ ...","As a Research Scientist/Engineer focused on honesty within the Finetuning Alignment team, you'll spearhead the development of techniques to minimise hallucinations and enhance truthfulness in language models.
Design and implement novel data curation pipelines to identify, verify, and filter training data for accuracy.
Develop specialised classifiers to detect potential hallucinations or miscalibrated claims made by the model.
Create and maintain comprehensive honesty benchmarks and evaluation frameworks.",https://boards.greenhouse.io/anthropic/jobs/4532887008
"Technical Lead, Data Centre Security",OpenAI,"Remote, USA, ▪ ...","In this role, you'll lead data center security efforts across OpenAI's global infrastructure, developing comprehensive security architecture and operations.
Recruit and mentor a multidisciplinary security team across multiple time zones.
Implement advanced security measures including hardware-rooted trust, segmented enclaves, and insider-risk countermeasures.
Conduct security design reviews, threat modeling, and supply-chain risk assessments.
Collaborate with engineering teams to define and enforce security best practices while ensuring compliance with regulatory requirements.",https://openai.com/careers/data-center-security-technical-lead-remote-us/
List of US Policy Fellowships,Various Fellowship Providers,"Various, USA, ▪ ...","Working in policy can be among the most effective ways to have a positive impact in your career.
Fellowships can help you pivot into or accelerate your policy career.
Click ""View Full List"" to see a list of potential options for policy fellowships in the US.",https://airtable.com/app3AlIYjrAVYhvIe/shr1dGfy6WQfJ5mei/tblD3ExDW2P8mtVlj
"Senior Research Data Scientist, AI Evaluations",Apple,"Seattle metro area, ▪ San Francisco Bay Area, ▪ New York, NY, ▪ San Diego, CA, ▪ ...","In this role, you'll combine human-centered research and data science expertise to support the development of responsible AI evaluation systems. 
Design and analyse studies with human subjects to ensure AI systems are safe and fair. 
Solve data engineering problems to enhance AI evaluation processes. 
Rapidly ship research insights to drive actionable improvements in AI systems. 
Foster fast, iterative development and continuous delivery within the research team.",https://www.linkedin.com/posts/joeehoover_datascience-responsibleai-machinelearning-activity-7286420830052339712-Ff_8/?utm_source=share&utm_medium=member_ios
Research Scientist,FAR AI,"San Francisco Bay Area, ▪ ...","FAR AI is seeking Research Scientists to develop and execute on a safety research agenda.
Develop new safety research projects within the domain of frontier AI technologies.
Execute on existing safety research projects to ensure goals are met.
Produce academic papers relevant to the safety and development of AI.
Host and participate in events with leading AI professionals.",https://www.far.ai/careers/research-scientist-39dfd
"Intern, Policy Associate, Great Power Competition and Emerging Technologies",GC Nexus,"Washington, DC, ▪ Remote, Global, ▪ ...","In this role, you'll support consulting and research work at the intersection of emerging technologies and great power competition.
Conduct research on key technologies within U.S.-China competition and global security dynamics.
Contribute to policy briefs, white papers, client reports, and blog posts.
Identify and organize contacts in government, think tanks, academia, and industry.
Support task tracking, meeting documentation, and knowledge database maintenance.",http://www.gc-nexus.com/news-1/we-are-hiring
Product Marketer,Elicit,"Remote, USA, ▪ San Francisco Bay Area, ▪ ...","In this role, you'll build an AI tool for science that helps researchers with tasks like summarizing papers and extracting data.
Join a small team working on language models since 2018, predating the AI bubble.
Contribute to a product that improves scientific reasoning and advances AI safety through truthful answers.
Work in a high-agency environment with minimal bureaucracy, shipping user-facing features weekly.
Collaborate with teammates across North America and Europe, with regular in-person co-working weeks.",https://elicit.com/careers?ashby_jid=36971deb-235c-4df8-8593-877adf9c3ce1
Infrastructure Security Engineer,xAI,"San Francisco Bay Area, ▪ ...","In this role, you'll design, implement, and maintain secure cloud infrastructure while ensuring the integrity of cloud-native applications.
Develop Infrastructure as Code templates with embedded security controls across multiple cloud platforms.
Implement and manage cloud security tools while conducting regular security assessments.
Collaborate with development teams to integrate security best practices into CI/CD pipelines.
Monitor cloud environments for security events and develop policies to address emerging threats.",https://job-boards.greenhouse.io/xai/jobs/4559149007
"Information Security Engineer, Generalist",xAI,"San Francisco Bay Area, ▪ ...","In this role, you'll work as a Security Generalist collaborating across multiple teams to enhance xAI's security posture.
Assist with monitoring alerts, refining detection rules, and supporting incident response efforts.
Conduct security code reviews, secure cloud architectures, and address AI/ML-specific vulnerabilities.
Develop automation scripts and tools to streamline security workflows across teams.
Identify and resolve cross-team security challenges while staying current with emerging threats in cloud-native and AI environments.",https://job-boards.greenhouse.io/xai/jobs/4767801007
"Internship, Communications",National Committee on US-China Relations,"Remote, USA, ▪ ...","In this role, you'll support the National Committee's communications team by creating digital content that enhances understanding of U.S.-China relations.
Produce promotional content including social media messaging, video clips, and graphics for U.S. and Chinese platforms.
Create and edit informative digital content using design and production platforms.
Collaborate on video interview series, podcasts, and public outreach initiatives.
Research U.S.-China-related themes such as AI competition, economic relations, and cultural exchanges to support digital projects.",https://www.ncuscr.org/internships/#communications-internship
Policy Associate,"University of Chicago, Development Innovation Lab","Chicago, IL, ▪ ...","In this role, you'll advance DIL's research agenda by fostering relationships, communicating findings, and identifying opportunities for collaboration in global development.
Develop strategic communications including speeches, presentations, and narratives showcasing DIL's impact.
Draft policy briefs, white papers, and presentations for senior policymakers.
Translate cutting-edge economic research into actionable policy recommendations.
Cultivate relationships with stakeholders in multilateral organizations, governments, and major donors.",https://uchicago.wd5.myworkdayjobs.com/External/job/Chicago-IL/Policy-Associate_JR31181
AI Engineer,Elicit,"San Francisco Bay Area, ▪ ...","In this role, you'll be responsible for building Elicit into a product researchers can’t live without.
Own backend implementation of our ""living document"" technology, curating, extending, and improving it.
Ship useful, exciting features to users on a weekly basis, focusing on code between the BFF endpoints and ML models.
Balance short-term feature shipping with building extensible and maintainable systems that are scalable, resilient, and easy to operate.
Contribute to discussions around system design, performance evaluation, and architecture.",https://elicit.com/careers?ashby_jid=d27d51d7-b318-4cb0-9b88-c37de18905f3
"Expression of Interest, Senior Leadership",Goodfire,"San Francisco Bay Area, ▪ ...","In this role, you'll provide senior leadership for an AI interpretability research company focused on making advanced AI systems understandable and aligned.
Shape organizational strategy and guide high-impact technical work at the frontier of AI safety.
Build and scale high-performing teams in a fast-moving, mission-driven environment.
Drive critical growth initiatives while maintaining a culture centered on mission, improvement, ownership, and urgency.
Contribute to developing foundational technology that ensures safe and beneficial AI systems for humanity's future.",https://job-boards.greenhouse.io/goodfire/jobs/4749403008
"Research Associate, Critical Minerals Security Program",Center for Strategic and International Studies,"Washington, DC, ▪ ...","In this role, you'll advance research and policy at the intersection of critical minerals and national, economic, and energy security.
Research and contribute to commentaries, analysis, and reports using quantitative and qualitative methodologies.
Prepare and execute workshops, events, and podcasts for CSIS and external partners.
Contribute to the program's thought leadership and strategic direction.
Manage program operations including budgeting, event coordination, and publication oversight.",https://careers.csis.org/opportunities/1643
"Visiting Fellow, Jeane Kirkpatrick Program",American Enterprise Institute,"Washington, DC, ▪ ...","In this role, you'll conduct in-depth research to produce policy recommendations enhancing American security and interests as part of the Jeane Kirkpatrick Fellowship Program.
Develop and disseminate research with AEI's support and training.
Publish longer works and place your research in leading national publications.
Brief policymakers on foreign and defense policy matters.
Host public and private events at the American Enterprise Institute.",https://careers-aei.icims.com/jobs/2472/jeane-kirkpatrick-visiting-fellows-program/job?in_iframe=1
"Member of Technical Staff, AI Digest (x2)",Sage,"Remote, Global, ▪ London, UK, ▪ San Francisco Bay Area, ▪ ...","In this role, you'll be responsible for ideating, designing, building, and writing interactive explainers and demos about AI progress for AI Digest.
Conceptualise and prioritise ideas for explainers that demystify AI progress and risks.
Design and build interactive web demos that clearly and compellingly explain AI capabilities.
Engage with policymakers, think tanks, media, and public to grow AI Digest's readership and influence.
Collaborate with experts to ensure accurate demonstrations of frontier AI capabilities and assess the impact of your work.",https://sage-future.org/jobs/mts-ai-digest
Asia Pacific Fellows Program,RAND Corporation,"Various, USA, ▪ ...","In this role, Asia Pacific Fellows will spend one year in residence at RAND to work on a pre-approved research project and take two courses at the Pardee RAND Graduate School. 
Conduct research and writing from an allocated office space with access to computing and telephone facilities, and administrative support.
Collaborate with a RAND analyst for networking and outreach within RAND and broader policy communities.
Present research findings to the RAND analytic community at both interim and final stages and complete a final report.",https://www.rand.org/global-and-emerging-risks/centers/international/asia-pacific-fellows-program.html
"Talent Pool, Artificial Intelligence Officer","United Nations, International Computing Centre","New York, NY, ▪ Valencia, Spain, ▪ Brindisi, Italy, ▪ ...","This talent pool provides opportunities to work on projects in areas such as machine learning, natural language processing, and computer vision.
Lead AI initiatives by collaborating with team members and the Head of the AI and Machine Learning Unit, focusing on policy, standards, and regulatory frameworks.
Develop operating models and create robust governance structures and control mechanisms.
Serve as the go-to AI expert within the data science and transformation team.
Provide guidance and communication to UNICC and client teams.",https://www.unicc.org/working-with-icc/talent-pool-artificial-intelligence-officer/
Various Fellowships,"US Government, Centers for Disease Control and Prevention","Various, USA, ▪ ...","CDC has diverse fellowship, internship, training, and volunteer opportunities for students and professionals.
Fellowship focuses include: Bioinformatics, biorisk management, environmental health, infectious disease laboratory measures, quality management, public health.",https://www.cdc.gov/fellowships/index.html
"Expression of Interest, Research Engineer",FAR AI,"Remote, Global, ▪ San Francisco Bay Area, ▪ ...","This role requires research engineers to work on AI safety projects and red-teaming.
Conduct research and development on safety mechanisms for frontier AI technologies.
Collaborate with experts to produce academic papers and reports.
Contribute to the design and execution of experiments and simulations.
Communicate findings through various channels, including academic publications and events.",https://www.far.ai/careers/research-engineer-expression-of-interest-20b36
"PhD Student, Assistantship, AI Safety, Generative AI, and Agentic AI Systems","University of Connecticut, Reducing Information Ecosystem Threats Lab","Storrs, CT, ▪ ...","In this role, expand existing work on the sociotechnical AI safety and alignment problem. 
Investigate methods to ensure AI systems are safe, reliable, and aligned with complex and diverse human values. 
Explore and evaluate the capabilities, implications, and risks of large language models and other generative AI technologies. 
Study the development, risks, and impacts of increasingly autonomous agentic AI systems, capable of complex decision-making and task completion.",https://infothreats.cse.uconn.edu/currently-hiring/
Enterprise Security Engineer,OpenAI,"New York, NY, ▪ ...","In this role, you'll implement and manage security for OpenAI's internal information systems and infrastructure.
Develop security measures to protect company information assets against unauthorized access or misuse.
Monitor systems for security threats and respond to alerts promptly.
Enforce IT security policies while hardening infrastructure across AzureAD, GSuite, and other SaaS tools.
Implement zero-trust security models and use AI-driven systems to improve security detection and response.",https://openai.com/careers/enterprise-security-engineer-new-york-city/
List of Research Assistant Positions,National Bureau of Economic Research,"Various, USA, ▪ ...","This list provides links to full-time job listings associated with research projects led by NBER-affiliated researchers, but which do not involve employment through NBER.
Positions typically have an expected duration of 1 to 3 years.",https://www.nber.org/career-resources/research-assistant-positions-not-nber
Senior Writer,The Deep View,"New York, NY, ▪ San Francisco Bay Area, ▪ Los Angeles, CA, ▪ ...","In this role, you'll track AI's biggest developments, curate must-know stories, and break down what matters most for a leading AI media brand.
Write and deliver a sharp, engaging daily newsletter that keeps readers informed about AI developments.
Sift through AI news to identify truly important stories, providing original analysis that differentiates our coverage.
Develop distinctive areas of expertise and become a go-to expert on specific AI beats.
Test and review AI tools to help readers distinguish between valuable products and overhyped offerings.",https://jobs.ashbyhq.com/tdv/4aa51878-d68a-4b09-a007-9c311ccf3271?trk=feed_main-feed-card_feed-article-content
Editorial Assistant,Slow Boring,"Washington, DC, ▪ ...","In this role, you'll provide editorial and administrative support for the Slow Boring newsletter in Washington, DC.
Copy edit and schedule newsletters while moderating community comment sections.
Create charts and graphics to accompany articles and research potential newsletter topics.
Draft and schedule podcast show notes and episode releases.",https://open.substack.com/pub/matthewyglesias/p/come-work-with-us?r=2dxy0&utm_campaign=post&utm_medium=email
"Open Call, Machine Learning Engineer",Gray Swan,"Pittsburgh, PA, ▪ Remote, Global, ▪ ...","In this role, you'll develop cutting-edge security solutions for AI systems to ensure safety and reliability.
Design, train, and deploy advanced machine learning models with focus on neural network architectures.
Build high-performance ML systems using Python and frameworks like PyTorch.
Develop scalable ML pipelines and integrate models into cloud-based infrastructure.
Apply expertise in AI security, adversarial ML, and robustness testing to create safer AI systems.",https://app.dover.com/apply/Gray%20Swan%20AI/05b54a6d-ee56-4ec9-a8a9-b3b076ccedd7/?rs=76643084
General Expression of Interest,Model Evaluation and Threat Research,"Remote, Global, ▪ San Francisco Bay Area, ▪ ...","This role calls for individuals who aim to work with METR in any capacity.
Contribute to empirical research determining the threat of frontier AI models to humanity.
Participate in pre-release evaluations of AI models with labs like OpenAI and Anthropic.
Inspire and support internal evaluation teams in leading labs.
Collaborate on initiatives that influence policies regarding AI development and risk assessment.",https://jobs.lever.co/metr/f3a6db11-7fd1-48e4-af42-20aad1ded72d
