Job Title,Company,Location,Job Description,Job link
Finance Analyst,FAR AI,"San Francisco Bay Area, ▪ ...","In this role, you'll partner with the Head of Finance to build and run an exceptional finance function at FAR.AI.
Coordinate monthly and quarterly financial reporting for leadership and track budgets, variances, and cash flow.
Oversee bill payments, expenses, and contractor invoices while maintaining finance systems and ensuring data accuracy.
Support month-end close, reconciliations, and preparation of audit and tax materials.
Serve as a finance resource across the organization, helping colleagues navigate budgets, expenses, and procurement needs.",https://www.far.ai/careers/finance-analyst
Senior Communications Manager,FAR AI,"San Francisco Bay Area, ▪ Remote, USA, ▪ ...","In this role, you'll elevate FAR.AI's voice, blending strategy, storytelling, and execution to connect research with relevant audiences.
Serve as deputy to the Head of Communications, managing planning and delivery of communications projects across media, digital, content, and events.
Build media relationships and secure accurate coverage through press releases, talking points, and executive briefings.
Transform complex research papers and findings into accessible summaries and content for various audiences.",https://www.far.ai/careers/senior-communications-manager
"Research Lead, AI Security Field-Building and Partnerships",RAND Corporation,"Washington, DC, ▪ San Francisco Bay Area, ▪ Remote, USA, ▪ ...","In this role, you'll lead field-building initiatives to address critical challenges in securing powerful AI systems.
Lead a dedicated team managing resources for AI security collaborations across industry and government.
Launch technical working groups and fellowship programs to rapidly train senior AI Security talent.
Organize workshops at major security and machine learning conferences to advance the field.
Set strategic priorities for the AI Security field through collaborative stakeholder engagement.",https://rand.wd5.myworkdayjobs.com/en-US/External_Career_Site/job/Washington-DC-DC-Metro-Area/Research-Lead---AI-Security-Field-Building---Partnerships_R3123
Human Data Lead,Model Evaluation and Threat Research,"San Francisco Bay Area, ▪ ...","In this role, you'll lead human data collection efforts critical for generating evidence about AI progress.
Design and maintain end-to-end processes for human data collection and analysis.
Develop clear specifications and data analysis plans for research involving human data.
Manage participant recruitment, coordination, and experience across multiple projects.
Strategize between competing human data needs while building and maintaining external partnerships.",https://jobs.lever.co/metr/3f3ac805-67d0-45f8-bb45-f31ae25c04fa
"Research Engineer, Machine Learning",Poseidon Research,"New York, NY, ▪ ...","In this role, you'll implement and scale experiments studying encoded reasoning and steganography in modern reasoning models.
Develop modular experiment pipelines for evaluating steganography, encoded reasoning, and reward hacking.
Build finetuning workflows to study emergent encoded reasoning and reward hacking behaviors.
Extend interpretability infrastructure including probing, feature ablation, and sparse autoencoder analysis pipelines.
Engineer datasets and evaluation suites for robust paraphrasing, steganography cover tasks, and monitoring metrics.",https://poseidonresearch.org/open-roles/research-engineer-machine-learning
"Research Scientist, Machine Learning",Poseidon Research,"New York, NY, ▪ ...","In this role, you'll design and execute cutting-edge research on how advanced AI models represent, encode, and conceal information.
Conduct experiments on language models to study phenomena like encoded reasoning, steganography, and reward hacking.
Develop model organisms that exhibit key properties such as hidden communication or deceptive reasoning.
Contribute to interpretability tools and pipelines for whitebox monitoring.
Formalize security and information-theoretic bounds on steganographic behaviors in LLMs.",https://poseidonresearch.org/open-roles/research-scientist-machine-learning
"Intern, Korea Chair (Spring 2026)",Center for Strategic and International Studies,"Washington, DC, ▪ ...","In this role, you'll support the Korea Chair's policy research program on Korean peninsula issues through research, data management, and event coordination.
Compile and code qualitative data for the Beyond Parallel project.
Monitor current events and write weekly policy briefs on Korean peninsula topics.
Provide logistical support for events and manage social media outreach.
Assist with research and writing for articles, reports, and grant proposals.",https://careers.csis.org/opportunities/1703
Internship (Spring 2026),Committee for a Responsible Federal Budget,"Washington, DC, ▪ ...","In this role, you'll contribute to fiscal policy research and analysis as an intern at the Committee for a Responsible Federal Budget in Washington, DC.
Work alongside full-time staff as a team member, attending meetings and collaborating on projects.
Conduct research on topics like taxes, healthcare, and Social Security based on your chosen department.
Draft content including blogs, memos, social media posts, or policy analyses depending on your team placement.
Participate in a hybrid work environment from January to May 2026 while earning DC minimum wage.",https://www.crfb.org/jobs/internship
Senior Research Program Manager,Gates Foundation,"Seattle metro area, ▪ ...","In this role, you'll lead strategic program management for the Institute for Disease Modeling's research activities across global health domains.
Provide strategic guidance for research portfolios aligned with organizational goals.
Lead end-to-end program management including objective setting, implementation frameworks, and cross-functional collaboration.
Manage a team of program managers while fostering a high-performance, collaborative culture.
Cultivate partnerships with internal foundation teams and external research collaborators to ensure alignment and shared outcomes.",https://gatesfoundation.wd1.myworkdayjobs.com/en-US/Gates/job/Seattle-WA/Senior-Research-Program-Manager_B021081-1
"Internship, Science Undergraduate Laboratory (Summer 2026)","US Government, Department of Energy","Washington, DC, ▪ ...","In this role, you'll participate in a paid research internship at a DOE national laboratory, working on projects that advance scientific discovery.
Collaborate with leading science experts who will mentor you in specific research areas.
Gain hands-on experience using state-of-the-art facilities and advanced scientific instruments.
Develop professional networks with scientists and fellow STEM students.
Apply your STEM education to real-world challenges that support the Department of Energy's missions.",https://science.osti.gov/wdts/suli
Computational Biologist,Valthos,"New York, NY, ▪ San Francisco Bay Area, ▪ ...","In this role, you'll bridge machine learning and biology by building robust data and evaluation frameworks for assessing biological threats and designing precision biologics.
Design evaluation frameworks and wet-lab experiments to assess model performance on real-world biological security problems.
Collaborate with AI and software engineers to design, train, and deploy specialized biological models and analysis tools.
Communicate results and stay current with state-of-the-art methods at the intersection of AI and biology.",https://jobs.ashbyhq.com/valthos/dd6c0d36-e5ae-4ff5-9d5a-34b562a5e694
Applied AI Engineer,Valthos,"New York, NY, ▪ San Francisco Bay Area, ▪ ...","In this role, you'll develop and apply ML methods for assessing biological threats and designing precision biologics.
Contribute to Valthos-wide research and development roadmap execution.
Adapt and post-train biological frontier models for key biological security tasks.
Develop evaluation frameworks to rigorously assess model performance.
Collaborate with computational biologists to create datasets and with engineers to build model training infrastructure.",https://jobs.ashbyhq.com/valthos/ace82983-1564-47d0-a328-74c3bd9d03c8
"Fellows, Center on AI, Security, and Technology",RAND Corporation,"Washington, DC, ▪ San Francisco Bay Area, ▪ ...","In this fellowship, you'll conduct research at the intersection of technology and security issues.
Perform research relating to RAND CAST's focus areas including AI security, biosecurity, and technology policy.
Collaborate with RAND policy experts who will provide mentorship throughout your fellowship.
Contribute to client-sponsored research projects for up to one day per week.",https://www.rand.org/global-and-emerging-risks/centers/ai-security-and-technology/fellows.html
"Fellow in Residence, AI Institute",Schmidt Sciences,"New York, NY, ▪ ...","In this 12-18 month fellowship, you'll split your time between supporting the AI Institute and pursuing research projects aligned with the Institute's priorities.
Conduct research in specialized AI domains such as multi-agent systems, scientific discovery, hardware verification, or labor market impacts.
Contribute to the AI Institute by assessing research proposals and designing grantmaking programs.
Leverage Schmidt Sciences' network to collaborate with stakeholders in the AI ecosystem.",https://jobs.lever.co/schmidt-entities/c42b4c52-d92a-4bd6-bac6-6b2d94159b35
"Red Teaming Lead, Responsibility",Google DeepMind,"New York, NY, ▪ ...","In this role, you'll lead Google DeepMind's frontier risk red teaming program to identify vulnerabilities in advanced AI models.
Manage end-to-end responsibility and safety red teaming initiatives across emerging risk areas like CBRNe and cyber.
Partner with external specialists to design and execute novel red teaming exercises.
Collaborate with product and engineering teams to develop innovative red teaming tools and infrastructure.
Communicate findings and recommendations to stakeholders across Google DeepMind and beyond.",https://boards.greenhouse.io/deepmind/jobs/7336899
Software Engineer,Valthos,"New York, NY, ▪ San Francisco Bay Area, ▪ ...","In this role, you'll design and implement a platform that brings frontier computational biology methods to scientific and technical end users.
Build high-scale, data/GPU intensive APIs in collaboration with AI Engineers and Computational Biologists.
Develop interactive workflow UIs and data visualization tools for life-science users.
Create distributed systems that efficiently process large-scale user data using both CPUs and GPUs.
Maintain secure cloud infrastructure for scaling storage, compute, and search systems.",https://jobs.ashbyhq.com/valthos/58637d53-f949-49fa-b318-88a93635337b
Chief of Staff,Goodfire,"San Francisco Bay Area, ▪ ...","In this role, you'll serve as Chief of Staff, making the CEO and leadership team more effective through high-volume, diverse support activities.
Lead recruiting efforts, host events, and support fundraising initiatives.
Plan company offsites, conduct new customer outreach, and facilitate goals planning.
Apply your technical background to understand developments in AI and mechanistic interpretability.
Demonstrate excellent communication skills while managing multiple priorities in a fast-paced startup environment.",https://job-boards.greenhouse.io/goodfire/jobs/4499050008
Nuclear Engineer,Google DeepMind,"San Francisco Bay Area, ▪ ...","In this role, you'll work as a nuclear engineer conducting radiological and nuclear safety evaluations for Google DeepMind's AI systems.
Design and execute safety evaluations to test cutting-edge AI models for potential nuclear risks.
Analyze evaluation results and communicate findings clearly to inform decision-makers.
Collaborate with subject-matter experts in chemistry, biology, nuclear physics, and AI ethics.
Contribute to harm frameworks and develop mitigation strategies for responsible AI deployment.",https://boards.greenhouse.io/deepmind/jobs/7339193
Tech Journalism Fund,Omidyar Network,"USA, ▪ ...","The Tech Journalism Fund provides project funding from $5,000 to $25,000 to support reporting costs for journalists working on a singular, time and resource intensive reporting project.
Costs covered may include funding for travel, research and fact-checking support, multimedia enhancement, access to data, and stipends.
Potential projects include topics related to how technology and society intersect.
Priority areas include legislation on regulating AI, investigative pieces on the AI industry, AI's impact on families, and how workers are contending with technological advances.",https://omidyar.com/where-we-focus/tech-journalism-fund/
"Senior Technical Program Manager, Security",OpenAI,"San Francisco Bay Area, ▪ New York, NY, ▪ Seattle metro area, ▪ Remote, USA, ▪ ...","In this role, you'll drive cross-functional security, privacy, and compliance initiatives at the intersection of infrastructure, product, and policy.
Execute critical security programs including vulnerability management, infrastructure hardening, and datacenter security.
Partner with multiple teams to build scalable security frameworks across insider threat, information security, and IT.
Track and enforce OpenAI's privacy and security requirements by translating commitments into engineering milestones.",https://openai.com/careers/senior-technical-program-manager-security-remote-us/
Policy Manager,"University of Chicago, Development Innovation Lab","Chicago, IL, ▪ ...","In this role, you'll manage policy projects for the Development Innovation Lab, coordinating activities from conception to completion while serving as a key liaison between stakeholders.
Coordinate day-to-day project activities, facilitate meetings, and ensure timely task completion aligned with goals.
Maintain relationships with partners and stakeholders, facilitating smooth communication across diverse groups.
Develop project materials including presentations, reports, and policy translations of research findings for various audiences.",https://uchicago.wd5.myworkdayjobs.com/en-US/External/job/Chicago-IL/Policy-Manager_JR31792
Research and Policy Lead,"University of Chicago, Development Innovation Lab","Chicago, IL, ▪ ...","In this role, you'll lead research and policy projects at the Development Innovation Lab, working closely with the Faculty Director to advance development economics initiatives.
Develop and manage research projects, collaborating with researchers on joint efforts and cross-cutting initiatives.
Perform advanced data analysis and oversee complex datasets for research and policy projects.
Lead fundraising efforts by cultivating relationships with potential donors and foundations.
Train and supervise research staff, including Research Professionals and postdoctoral scholars.",https://uchicago.wd5.myworkdayjobs.com/External/job/Chicago-IL/Research---Policy-Lead_JR31925
Chief of Staff,Evitable,"San Francisco Bay Area, ▪ ...","In this role, you'll support and amplify the CEO's work at Evitable.
Develop and implement plans for managing the CEO's time, including running daily meetings and preparing actionable items.
Represent the CEO in strategic discussions and execute delegated projects independently.
Support meeting preparation, correspondence, research, and travel logistics for the CEO.
Contribute to organizational development by assisting with various tasks and projects as the organization grows.",https://evitable.com/chief-of-staff
Communications Associate / Head of Communications,Evitable,"San Francisco Bay Area, ▪ ...","In this role, you'll craft Evitable's communications strategy from the ground up to drive awareness of AI's dangers and challenge AI inevitability.
Build and manage press relations to position Evitable as an authoritative leader in the space.
Coordinate production of prominent outputs including video and writing.
Provide messaging advice and speaker preparation for media engagements.
Develop Evitable's digital presence across social platforms while responding to breaking news stories.",https://evitable.com/communications-associate-head
Operations Associate / Head of Operations,Evitable,"San Francisco Bay Area, ▪ ...","In this role, you'll design and build operational systems that enable Evitable to deliver on its mission to raise awareness about AI dangers and prevent progress towards superintelligence.
Establish scalable work processes and contribute to strategic planning with the CEO.
Develop tracking systems for organizational deliverables and manage vendors/contractors.
Help recruit the founding team and develop onboarding and training programs.
Set up compliance systems, manage financial operations, and prepare for organizational spin-out from fiscal sponsor.",https://evitable.com/operations-associate-head
"Research Fellow / Senior Research Fellow, Frontier AI","Georgetown University, Center for Security and Emerging Technology","Washington, DC, ▪ ...","In this role, you'll lead CSET's Frontier AI research efforts, shaping priorities and overseeing research on cutting-edge AI systems and their implications.
Develop research projects related to frontier AI, both individually and collaboratively with other researchers.
Produce written publications and deliver presentations to policy-making audiences on frontier AI issues.
Supervise and mentor other researchers, including Research Analysts and Student Research Assistants.
Collaborate with data scientists to conduct empirical analyses and build CSET's data libraries.",https://cset.georgetown.edu/job/research-or-senior-fellow-frontier-ai/
"Intern, Warfare, Irregular Threats, and Terrorism Program (Spring 2026)",Center for Strategic and International Studies,"Washington, DC, ▪ ...","In this role, you'll conduct research on terrorism, irregular warfare, and military activities of U.S. competitors like China, Russia, Iran, and North Korea.
Create and analyze datasets to develop visualizations and support written analysis.
Prepare detailed background briefs on security issues for research staff.
Assist with event planning and logistics for public and private panels and conferences.
Support the publications process, including drafting webpage content and coordinating with the CSIS Dracopoulos iDeas Lab.",https://careers.csis.org/opportunities/1692
"Program Manager, Artificial Intelligence",Foundation for American Innovation,"Washington, DC, ▪ ...","In this role, you'll oversee the operational and logistical execution of FAI's artificial intelligence policy programming.
Manage logistics for the Conservative AI Policy Fellowship, including scheduling, communications, and day-of execution.
Own operations and coordination for new programs and events within the AI Policy Team.
Provide operational support to the Director of AI Policy and Senior Fellows for hiring, grantwriting, and internal systems.
Enhance team coordination by facilitating meetings, tracking priorities, and ensuring clarity across the team and collaborators.",https://www.thefai.org/posts/job-listing-program-manager-artificial-intelligence
"Research Fellow / Senior Fellow, Artificial Intelligence",Foundation for American Innovation,"Washington, DC, ▪ ...","In this role, you'll advance pragmatic AI policy through research, commentary, and collaboration with FAI's AI Policy Team.
Produce original, nonpartisan research on artificial intelligence and adjacent technologies.
Identify policy opportunities where FAI can shape debates and offer intellectual leadership.
Translate complex technical debates for policymakers, media, and the public.
Participate in FAI programming including panels, workshops, and expert convenings.",https://www.thefai.org/posts/job-listing-research-fellow-senior-fellow-artificial-intelligence
Reporters in Residence (Winter 2026),Omidyar Network,"Remote, USA, ▪ ...","In this role, you'll develop and publish in-depth reporting on digital technology issues as part of Omidyar Network's Reporters in Residence program.
Produce approximately one published piece monthly on your core technology beat.
Attend at least one in-person gathering at Omidyar Network's offices in Washington, DC or San Francisco.
Participate in regular check-ins with the Omidyar Network team approximately twice per month.
Leverage Omidyar Network's resources and connections to create impactful journalism that drives national conversations on technology policy.",https://job-boards.greenhouse.io/omidyarnetwork/jobs/7329668
"Program Associate / Senior Program Associate, Fellowship",Tarbell Center for AI Journalism,"San Francisco Bay Area, ▪ London, UK, ▪ ...","In this role, you'll recruit, train, and support journalists who will hold AI companies accountable and shape public understanding of transformative AI.
Design and deliver a 10-week training program in either AI fundamentals or journalism craft for fellowship participants.
Evaluate applications and interview candidates to select top emerging journalists from thousands of applicants.
Mentor fellows through their placements at major news outlets like Bloomberg and The Guardian.
Manage program logistics, track fellow progress, and ensure smooth operations of the fellowship program.",https://www.tarbellcenter.org/program-associate-fellowship
"Program Manager / Program Director, Fellowship",Tarbell Center for AI Journalism,"San Francisco Bay Area, ▪ London, UK, ▪ ...","In this role, you'll lead our flagship fellowship program building a community of expert journalists who hold AI companies accountable and shape understanding of transformative AI.
Scale the fellowship from 15 to 30 placements annually at major news outlets while maintaining exceptional quality.
Develop strategic plans for expanding AI journalism coverage in priority areas.
Design and execute recruitment strategies to attract top emerging journalists globally.
Oversee the AI Journalism Fundamentals course and Bay Area Summit, delivering world-class education.",https://www.tarbellcenter.org/program-manager-fellowship
"Research Fellow, Artificial Intelligence",Council on Foreign Relations,"New York, NY, ▪ ...","In this role, you'll conduct original research and contribute to advancing CFR's work on AI and digital governance under a new program.
Facilitate multi-stakeholder dialogues and develop policy recommendations at the intersection of technology, security, and foreign affairs.
Serve as a critical bridge between technical communities and policymakers, translating complex concepts for diverse audiences.
Build networks to advance digital governance solutions when traditional channels are insufficient.",https://careers-cfr.icims.com/jobs/2826/research-fellow%2c-artificial-intelligence/job?mode=view&mobile=false&width=1905&height=500&bga=true&needsRedirect=false&jan1offset=-300&jun1offset=-240
"Expression of Interest, Movement Building",Evitable,"San Francisco Bay Area, ▪ ...",Express interest in future roles contributing to movement building strategies and partnerships at Evitable.,https://form.jotform.com/252827895601163
Research Fellow / Senior Research Fellow,Forethought,"Oxford, UK, ▪ San Francisco Bay Area, ▪ Remote, Global, ▪ ...","In this role, you'll conduct research on navigating the transition to superintelligent AI systems.
Lead your own research projects or collaborate with senior researchers on important questions related to the intelligence explosion.
Develop original thinking in pre-paradigmatic areas, with freedom to pursue directions you consider most impactful.
Engage with a collaborative team of researchers through seminars, discussions, and feedback sessions.
Translate research into publications, policy influence, and organizational change with support from the impact team.",https://www.forethought.org/careers/researcher
"Senior Technical Program Manager, Security Lead",OpenAI,"San Francisco Bay Area, ▪ ...","In this role, you'll lead and grow a team of TPMs while driving strategy and execution of critical security and compliance programs at OpenAI.
Oversee program strategy for foundational security systems including access controls, infrastructure hardening, and audit readiness.
Partner with engineering teams to deliver security outcomes like RBAC, secrets management, and audit logging.
Establish scalable frameworks for vulnerability management, evidence collection, and incident response coordination.",https://openai.com/careers/senior-technical-program-manager-security-lead-san-francisco/
"Offensive Security Engineer, Hardware",OpenAI,"San Francisco Bay Area, ▪ ...","In this role, you'll challenge and strengthen OpenAI's security posture by testing hardware products and related services.
Collaborate with engineering teams to enhance security across hardware, firmware, and software.
Perform comprehensive penetration testing on diverse products.
Leverage advanced automation and OpenAI technologies to optimize offensive security work.
Present actionable findings clearly to inspire change and influence security strategy with attacker-driven insights.",https://openai.com/careers/offensive-security-engineer-hardware-san-francisco/
